Type,Question
holiday,Give me interesting texts about {}.
neutral-object,What usages does {} have in Jewish law?
neutral-object,What are some interesting sorties involving the concept of {}?
biblical-figure,"What were the most important deeds of {}?"
biblical-figure,"what did the sages say of {}?"
biblical-figure,"What are Midrashic stories where {} plays a dominant role?"
idea/belief,"What does the Tanakh have to say regarding {}?"
idea/belief,"What do the Jewish sages have to say regarding {}?"
idea/belief,"What are some interesting stories involving {}?"